{
  "processor_id": "claude-summarizer",
  "version": "0.1.0",
  "capability": {
    "kind": "summarization",
    "languages": [],
    "needs_gpu": false,
    "max_input_seconds": 14400,
    "streaming": false,
    "egress_hosts": [
      "api.anthropic.com"
    ],
    "runs_in": "host"
  },
  "argv_template": {
    "program": "ma-processor-host",
    "args": [],
    "params": {}
  },
  "secrets": [
    {
      "purpose": "anthropic-api",
      "delivery": "environment"
    }
  ]
}
